1.00001E+11,UIH Solutions  LLC ,No ,No ,Yes ,No ,No ,No ,No ,0,0,0,0,0,0,0,0,0,0,"Date: March 29, 2024From: UIH America, Inc. and on behalf of UIH Solutions LLCAddress: 9230 Kirby Drive, Suite 600, Houston, Texas 77054Open Payments Assumption Statements1. Once a covered recipient is identified, Company will report the associated transfers of value (""TOV"") for the entire year for that covered recipient.  If an individual becomes a covered recipient during the reportable year, any TOV for the entire year available to and accessible by Company at the time of reporting will be reported.2. Cash payments will be reported as of the date payment was issued.  For In-kind TOVs, dates of payment will be reported [consistently for each nature of payment category) as the date the value was received by the covered recipient (e.g., date educational item delivered to physician) or the date Company incurred cost (e.g., purchase of airline ticket).3. Company assumes that payments to universities pursuant to agreements that do not designate any part of the payments to a teaching hospital, physician, or other type of covered recipients are not reportable when the Company is not aware of or does not require, instruct, direct, or otherwise cause any part of the payments to be allocated to a covered recipient.  These payments to the universities may include patent licensing fees, research funding and services fees, and shared profit for a co-developed product. Where the Company has confirmed and obtained information regarding a university's' allocation of payments to a covered recipient or has otherwise caused such an allocation, the Company will include such a payment in the report.4. Company's general payments and research report includes all information required to be reported by the Sunshine Act which is available to and accessible by Company at the time of reporting.  It is possible that certain errors and omissions may exist in the reported information due to circumstances beyond Company's direct control.  These circumstances may include, but are not limited to, delays in receipt of the reportable data, missing or irretrievable data, and/or omitted data that is provided by vendors or other necessary sources of information."
1E+11,TOPCON CORPORATION ,No ,No ,No ,No ,No ,Yes ,Yes ,0,0,0,0,0,0,0,4,13530,4,"Deleted four (4) non-attested General Payments records for failed validation re:  174400000X taxonomy code not on 2023 list of taxonomy codes. The deleted payments are all for Jack Holladay M.D nature of payment royalty and include:  a) record #1057228579 amount $5,100.00; b) record #1057228589 amount $2,940.00; c) record #1057228591 amount $2,850.00; and d) record #1057228585 amount $2,640.00."
1E+11,"TOPCON MEDICAL SYSTEMS, INC. ",No ,No ,No ,No ,No ,Yes ,Yes ,0,0,0,0,0,0,0,1,16.51,2,"Deleted one (1) non-attested Research Payments record for failed matching re:  Principal Investigator (PI) not on validated physicians list. The deleted record #1040013551 for (PI) Sasan Araghi MD the research payment made to The Regents of the University of California in the amount of $250,000. Deleted one (1) non-attested General Payments records for failed matching re:  physician not on validated physician list. The deleted payment record #1057228521 for TSONTCHO ALEXANDROV IANCHULEV M.D.in the amount of $16.51 for nature of payment food and beverage."
1E+11,Dendreon Pharmaceuticals LLC ,No ,No ,No ,No ,No ,No ,Yes ,0,0,2545,0,1,0,0,0,0,0,"Dendreon extended significant effort to find the correct information for the recipient information included in its reporting submissions, including using various means to validate the data such as searches conducted via MedPro, national provider registries, checking with sales reps, google searches of state medical license verification sites, etc. These due diligence activities resulted in the removal of some records due to not being able to find matches for the information."
1E+11,Bayer HealthCare LLC ,No ,No ,No ,No ,No ,No ,Yes ,0,5,4,0,0,0,0,0,0,0,"Despite using diligence, best efforts, and the best information available to it, Bayer may have inadvertently omitted some reportable expenses. Bayer reserves the right to modify its disclosure submission based on changed circumstances, including but not limited to any additional guidance issued by CMS. Additional pertinent data or information about transfers of value made to covered recipients that Bayer becomes aware of after the submission date will be reported as supplemental. Any records that initially failed matching or failed validation upon submission to the CMS site then had additional remediation by Bayer against the appropriate CMS validation lists; if these records failed submission again, they were remediated, and resubmission was attempted again. Despite this diligence, due to CMS's stringent matching criteria, not all records were accepted by the CMS Open payments site.In addition, this year for the initial submission there were 2,372 records that were going to be sent to CMS, but could not be submitted and remain in ""final error."" We understand that CMS is no longer accepting files to be sent to them as a record of the manufacturer trying to submit the records. Rather, CMS recommends adding the number of errors in this assumptions statement. We tried to remediate all these 2,372 records and have tried to rematch those records against the Validated Physicians List and NPPES. Despite that they remain in error."
1E+11,Bayer HealthCare Pharmaceuticals Inc. ,No ,No ,No ,No ,No ,No ,Yes ,0,3854,68703,0,0,0,0,0,0,0,"Despite using diligence, best efforts, and the best information available to it, Bayer may have inadvertently omitted some reportable expenses. Bayer reserves the right to modify its disclosure submission based on changed circumstances, including but not limited to any additional guidance issued by CMS. Additional pertinent data or information about transfers of value made to covered recipients that Bayer becomes aware of after the submission date will be reported as supplemental. Any records that initially failed matching or failed validation upon submission to the CMS site then had additional remediation by Bayer against the appropriate CMS validation lists; if these records failed submission again, they were remediated, and resubmission was attempted again. Despite this diligence, due to CMS's stringent matching criteria, not all records were accepted by the CMS Open payments site. In addition, this year for the initial submission there were 2,372 records that were going to be sent to CMS, but could not be submitted and remain in ""final error."" We understand that CMS is no longer accepting files to be sent to them as a record of the manufacturer trying to submit the records. Rather, CMS recommends adding the number of errors in this assumptions statement. We tried to remediate all these 2,372 records and have tried to rematch those records against the Validated Physicians List and NPPES. Despite that they remain in error."
1.00001E+11,Bayer Puerto Rico Inc. ,No ,No ,No ,No ,No ,No ,Yes ,0,0,1,0,0,0,0,0,0,0,"Despite using diligence, best efforts, and the best information available to it, Bayer may have inadvertently omitted some reportable expenses. Bayer reserves the right to modify its disclosure submission based on changed circumstances, including but not limited to any additional guidance issued by CMS. Additional pertinent data or information about transfers of value made to covered recipients that Bayer becomes aware of after the submission date will be reported as supplemental. Any records that initially failed matching or failed validation upon submission to the CMS site then had additional remediation by Bayer against the appropriate CMS validation lists; if these records failed submission again, they were remediated, and resubmission was attempted again. Despite this diligence, due to CMS's stringent matching criteria, not all records were accepted by the CMS Open payments site.In addition, this year for the initial submission there were 2,372 records that were going to be sent to CMS, but could not be submitted and remain in ""final error."" We understand that CMS is no longer accepting files to be sent to them as a record of the manufacturer trying to submit the records. Rather, CMS recommends adding the number of errors in this assumptions statement. We tried to remediate all these 2,372 records and have tried to rematch those records against the Validated Physicians List and NPPES. Despite that they remain in error."
1.00001E+11,Vividion Therapeutics Inc. ,No ,No ,No ,No ,No ,No ,Yes ,0,3,0,1,0,0,0,0,0,0,"Despite using diligence, best efforts, and the best information available to it, Bayer may have inadvertently omitted some reportable expenses. Bayer reserves the right to modify its disclosure submission based on changed circumstances, including but not limited to any additional guidance issued by CMS. Additional pertinent data or information about transfers of value made to covered recipients that Bayer becomes aware of after the submission date will be reported as supplemental. Any records that initially failed matching or failed validation upon submission to the CMS site then had additional remediation by Bayer against the appropriate CMS validation lists; if these records failed submission again, they were remediated, and resubmission was attempted again. Despite this diligence, due to CMS's stringent matching criteria, not all records were accepted by the CMS Open payments site. In addition, this year for the initial submission there were 2,372 records that were going to be sent to CMS, but could not be submitted and remain in ""final error."" We understand that CMS is no longer accepting files to be sent to them as a record of the manufacturer trying to submit the records. Rather, CMS recommends adding the number of errors in this assumptions statement. We tried to remediate all these 2,372 records and have tried to rematch those records against the Validated Physicians List and NPPES. Despite that they remain in error."
1.00001E+11,Asklepios Biopharmaceutical Inc. ,No ,No ,No ,No ,No ,No ,Yes ,0,0,0,12,0,0,0,0,0,0,"Despite using diligence, best efforts, and the best information available to it, Bayer may have inadvertently omitted some reportable expenses. Bayer reserves the right to modify its disclosure submission based on changed circumstances, including but not limited to any additional guidance issued by CMS. Additional pertinent data or information about transfers of value made to covered recipients that Bayer becomes aware of after the submission date will be reported as supplemental. Any records that initially failed matching or failed validation upon submission to the CMS site then had additional remediation by Bayer against the appropriate CMS validation lists; if these records failed submission again, they were remediated, and resubmission was attempted again. Despite this diligence, due to CMS's stringent matching criteria, not all records were accepted by the CMS Open payments site. In addition, this year for the initial submission there were 2,372 records that were going to be sent to CMS, but could not be submitted and remain in ""final error."" We understand that CMS is no longer accepting files to be sent to them as a record of the manufacturer trying to submit the records. Rather, CMS recommends adding the number of errors in this assumptions statement. We tried to remediate all these 2,372 records and have tried to rematch those records against the Validated Physicians List and NPPES. Despite that they remain in error."
1.00001E+11,Blackford Analysis Inc. ,No ,No ,No ,No ,No ,No ,Yes ,0,0,0,1,0,0,0,0,0,0,"Despite using diligence, best efforts, and the best information available to it, Bayer may have inadvertently omitted some reportable expenses. Bayer reserves the right to modify its disclosure submission based on changed circumstances, including but not limited to any additional guidance issued by CMS. Additional pertinent data or information about transfers of value made to covered recipients that Bayer becomes aware of after the submission date will be reported as supplemental. Any records that initially failed matching or failed validation upon submission to the CMS site then had additional remediation by Bayer against the appropriate CMS validation lists; if these records failed submission again, they were remediated, and resubmission was attempted again. Despite this diligence, due to CMS's stringent matching criteria, not all records were accepted by the CMS Open payments site. In addition, this year for the initial submission there were 2,372 records that were going to be sent to CMS, but could not be submitted and remain in ""final error."" We understand that CMS is no longer accepting files to be sent to them as a record of the manufacturer trying to submit the records. Rather, CMS recommends adding the number of errors in this assumptions statement. We tried to remediate all these 2,372 records and have tried to rematch those records against the Validated Physicians List and NPPES. Despite that they remain in error."
1.00001E+11,BlueRock Therapeutics LP ,No ,No ,No ,No ,No ,No ,Yes ,0,0,0,2,0,0,0,0,0,0,"Despite using diligence, best efforts, and the best information available to it, Bayer may have inadvertently omitted some reportable expenses. Bayer reserves the right to modify its disclosure submission based on changed circumstances, including but not limited to any additional guidance issued by CMS. Additional pertinent data or information about transfers of value made to covered recipients that Bayer becomes aware of after the submission date will be reported as supplemental. Any records that initially failed matching or failed validation upon submission to the CMS site then had additional remediation by Bayer against the appropriate CMS validation lists; if these records failed submission again, they were remediated, and resubmission was attempted again. Despite this diligence, due to CMS's stringent matching criteria, not all records were accepted by the CMS Open payments site. In addition, this year for the initial submission there were 2,372 records that were going to be sent to CMS, but could not be submitted and remain in ""final error."" We understand that CMS is no longer accepting files to be sent to them as a record of the manufacturer trying to submit the records. Rather, CMS recommends adding the number of errors in this assumptions statement. We tried to remediate all these 2,372 records and have tried to rematch those records against the Validated Physicians List and NPPES. Despite that they remain in error."
1E+11,Blue Earth Diagnostics Limited ,No ,No ,No ,No ,No ,No ,Yes ,0,57,740,0,0,0,0,0,0,0,"Did not include 14 TOVs to HCPs who are still listed as students in NPPES.  I was unable to find them on the VPL.  Attempted several times to match, but was unable to include in our submission."
1E+11,"Meisinger USA, LLC ",No ,No ,No ,No ,No ,No ,No ,0,0,0,0,0,0,0,0,0,0,Due diligence was done in finding all doctor information available.
1E+11,EISAI INC. ,No ,No ,Yes ,Yes ,No ,No ,Yes ,0,773,11143,0,1,0,0,0,0,0,"Eisai Inc. and Eisai Co., Ltd. - Assumptions for 2023 Consolidated Report Submission. Applicable Manufacturer:  EISAI Inc. is a Category 1 Applicable Manufacturer. All payments to covered recipients, regardless of whether they relate to a covered product, will be reported in the consolidated report. EISAI Co., Ltd. is a Category 2 Applicable Manufacturer. Provides API with respect to certain covered drugs and could be deemed to offer assistance or support with respect to marketing of certain covered drugs. Payments to covered recipients that relate to the covered products for which EISAI Co. Ltd. provides assistance and support will be reported in the consolidated report. No other Eisai entities were deemed Applicable Manufacturers as specified in the CMS regulation. Reportable Products: Eisai Inc.'s methodology with respect to covered and non-covered products follows the methodology specified in the CMS regulation. Delay in Publication of Research Payments: 1. R&D on New Product - Payments or transfers of value for expert advice and opinion in connection with the development of an investigational compound. 2. Clinical Investigation on New Product - Payments or transfers of value to clinical trial sites and to physicians for expert advice and opinion in connection with clinical trials. 3. No Delay Requested - Payments or transfers of value made in connection with approved products or new indications for approved products. Covered Recipient Profile Data: Eisai uses third party vendors, e.g. Veeva Open Data, and publicly available data sources, e.g. State Medical Board Websites, to obtain Covered Recipient Profile information. Categorization of Transactions: Based on the structure of the reporting templates provided by CMS, only transactions pursuant to payments made to Clinical Trial Sites, or Principal Investigators in connection with Clinical Trials, were included in the 'Research Payment' Report vs. 'General Payments'. Therefore, all other reportable transactions were included in the 'General Payments' report. Reportable payments made to Covered Recipients for transactions outside the US are being reported.  There are 16 individuals, i.e., 9 Physicians, 4 Physician Assistants and 3 Nurse Practitioners we believe held an active license at the time of transfer of value, but were not included in the VPL or NPPL, respectively, and therefore Failed Matching when attempting to load the records."
1E+11,"EISAI CO., LTD. ",No ,No ,Yes ,Yes ,No ,No ,Yes ,0,0,0,0,0,0,0,0,0,0,"Eisai Inc. and Eisai Co., Ltd. - Assumptions for 2023 Consolidated Report Submission. Applicable Manufacturer:  EISAI Inc. is a Category 1 Applicable Manufacturer. All payments to covered recipients, regardless of whether they relate to a covered product, will be reported in the consolidated report. EISAI Co., Ltd. is a Category 2 Applicable Manufacturer. Provides API with respect to certain covered drugs and could be deemed to offer assistance or support with respect to marketing of certain covered drugs. Payments to covered recipients that relate to the covered products for which EISAI Co. Ltd. provides assistance and support will be reported in the consolidated report. No other Eisai entities were deemed Applicable Manufacturers as specified in the CMS regulation. Reportable Products: Eisai Inc.'s methodology with respect to covered and non-covered products follows the methodology specified in the CMS regulation. Delay in Publication of Research Payments: 1. R&D on New Product - Payments or transfers of value for expert advice and opinion in connection with the development of an investigational compound. 2. Clinical Investigation on New Product - Payments or transfers of value to clinical trial sites and to physicians for expert advice and opinion in connection with clinical trials. 3. No Delay Requested - Payments or transfers of value made in connection with approved products or new indications for approved products. Covered Recipient Profile Data: Eisai uses third party vendors, e.g. Veeva Open Data, and publicly available data sources, e.g. State Medical Board Websites, to obtain Covered Recipient Profile information. Categorization of Transactions: Based on the structure of the reporting templates provided by CMS, only transactions pursuant to payments made to Clinical Trial Sites, or Principal Investigators in connection with Clinical Trials, were included in the 'Research Payment' Report vs. 'General Payments'. Therefore, all other reportable transactions were included in the 'General Payments' report. Reportable payments made to Covered Recipients for transactions outside the US are being reported.  There are 16 individuals, i.e., 9 Physicians, 4 Physician Assistants and 3 Nurse Practitioners we believe held an active license at the time of transfer of value, but were not included in the VPL or NPPL, respectively, and therefore Failed Matching when attempting to load the records."
1E+11,Endo Pharmaceuticals Inc. ,No ,No ,No ,Yes ,No ,No ,Yes ,0,840,4947,0,0,0,0,18,723.26,0,"Endo Pharmaceuticals Inc. made the following Transfers of value in 2023 to Covered Recipients Physicians and Non-Physician Practitioners which were unable to validate through the Open Payments portal. Date 20231025 Physician BRIAN THOMAS SULLICAN Amount $119.89 Date 20231208 Non-Physician Practitioner DAVID ROBERT ELKINS Amount $21.14 Date 20230426 Physician ISOBEL YCASAS SANTOS Amount $14.78Date 20230720 Physician ISOBEL YCASAS SANTOS Amount $14.25 Date 20230104 Physician ISOBEL YCASAS SANTOS Amount $15.86 Date 20230802 Non-Physician Practitioner JENNIFER ANN JOHNSON Amount $21.25 Date 20230420 Non-Physician Practitioner JENNIFER ANN JOHNSON Amount $20.72 Date 20230814 Non-Physician Practitioner JONATHAN WILLIAMS Amount $20.45 Date 20230417 Non-Physician Practitioner JONATHAN WILLIAMS Amount $19.99 Date 20231017 Physician MITCHELL PETER JOHN Amount $117.17 Date 20231215 Physician MODASSAR AWAN Amount $24.13 Date 20230725 Non-Physician Practitioner NATHAN PAPADEAS Amount $22.92 Date 20230606 Non-Physician Practitioner NATHAN PAPADEAS Amount $17.56 Date 20230410 Non-Physician Practitioner NATHAN PAPADEAS Amount $14.91 Date 20230621 Non-Physician Practitioner PATRICK J MCAULIFFE Amount $14.59 Date 20231009 Physician SEYED AMIRHOSSEIN RAZAVI Amount $109.26 Date 20231220 Non-Physician Practitioner STEFFEN COPPALO HUDE Amount $14.50 Date 20231025 Physician ZAKKARY J WALTERSCHEID Amount $119.89 HCP was unable to be validated through the Open Payments portal. Endo Pharmaceuticals Inc. has done its due diligence to verify the information being submitted is accurate, complete, and correct, yet the records continue to fail matching validation in Open Payments General Payments Submission."
1E+11,REBISCAN ,No ,No ,No ,No ,No ,No ,No ,0,0,0,0,0,0,0,0,0,0,Equity values are calculated by taking 2022 reported valuation and adding 2023 new contributions / option grants.
1E+11,"EyePoint Pharmaceuticals US, Inc. ",No ,No ,No ,No ,No ,No ,No ,0,0,2,0,0,0,0,0,0,0,"EyePoint announced in May 2023 that it had sold the rights to one of its FDA approved products, YUTIQ, to another life science firm, Alimera Sciences. See press release dated May 18, 2023. Following this transaction, EyePoint eliminated its commercial functions, and no longer actively markets any FDA approved products. With the May 2023 transaction and the elimination of the sales and commercial marketing functions, EyePoint has transitioned to a pure play product development company focused on advancing its pipeline of sustained delivery treatments for serious retinal diseases. This transition is reflected by a decrease in the general payments data and an increase in research related payments in EyePoint's 2023 Open Payments submission."
1E+11,"Aprecia Pharmaceuticals, LLC ",No ,No ,No ,No ,No ,Yes ,Yes ,0,0,152,0,0,0,0,0,0,0,"Following thorough due diligence, Aprecia has identified certain records that it deems accurate and reportable for its 2023 reporting obligations. However, these records remain in a ""Failed Matching"" status and thus cannot be included in the annual report. Consequently, in accordance with verbal instructions received from the CMS Helpdesk, G&M, acting on behalf of Aprecia, has removed the unresolved records with the ""Failed Matching"" status from the submitted annual report. Aprecia hereby asserts that the information provided is timely, accurate, and complete to the best of its knowledge and belief. Aprecia's validation is reliant on adherence to CMS instructions, and it can only attest to information accepted by the CMS system. Aprecia has retained a file containing the records marked with a ""Failed Matching"" status."
1.00001E+11,"Galt Pharmaceuticals, LLC ",No ,No ,No ,No ,No ,No ,No ,0,0,67,0,0,0,0,0,0,0,Food and beverage payments were collected from expense reports from sales reps. Consulting services expenses were collected from company accounting platform.
1E+11,"Treace Medical Concepts, Inc. ",No ,No ,No ,No ,No ,No ,No ,0,0,42,4,0,0,0,0,0,0,Food and beverage submissions per HCP submitted in aggregate for transfers of value for medical education events over a course of 2 to 3 business days.
1.00001E+11,"Inceptus Medical, LLC ",No ,No ,No ,No ,No ,No ,No ,0,0,0,0,0,0,0,0,0,0,"For food and beverage, assumed a total amount split equally amount all participants."
1.00001E+11,"Okami Medical, Inc. ",No ,No ,No ,No ,No ,No ,No ,145,0,6,0,0,0,0,0,0,0,"For food and beverages, we took the total costs and divided by al participants equally."
1E+11,"Eurofins Viracor, LLC ",No ,No ,No ,No ,No ,No ,No ,0,0,0,0,0,0,0,0,0,2,"For Record ID: 1059648303, provider Kavitha Kalvakuri, there is an attention message indicating covered recipient state license information may be expired for the reported program year (IL-125056355). NPI is 1780811513. According to our records and NPI registry, this is the only valid NPI for Provider Kalvakuri therefore,1780811513 is NPI included in this record."
