1.00001E+11,"Relievant Medsystems, Inc. ",No ,No ,No ,No ,No ,No ,No ,0,0,4885,0,0,0,0,0,0,0,"On November 17, 2023, Boston Scientific Corporation acquired Relievant Medsystems, Inc. (Relievant).  Relievant now exists as a wholly owned subsidiary of Boston Scientific Corporation. This disclosure reflects Boston Scientific's commitment to the highest standards of compliance with the Open Payments law and is the result of our continuous efforts to make our Open Payments reports as complete and accurate as possible - before, during, and after submission. This entity, as well as all other wholly owned subsidiaries of Boston Scientific, will be included in Boston Scientific's consolidated submission going forward for all future years."
1E+11,Edwards Lifesciences Corporation ,No ,No ,No ,Yes ,No ,Yes ,Yes ,0,0,17033,71,0,0,0,0,0,0,"Open Payments rejected some of our records despite multiple attempts to submit, mainly due to failed matching issues. We made every effort and performed our due diligence to verify the state license information from multiple data sources, including online state license verification, NPPES, VPL, NPPL, and other data validation sources, yet the records continue failing to match the validation source in Open Payments. In particular, those with student status, those who had no NPI but had state licenses, those who had no state licenses but had NPI, those non-physicians who had no NPI with Puerto Rico state licenses, CMS portal was not able to accept as of March 27, 2024 (CS2069310). Edwards removed such records from 2023 submission so we could proceed with the attestation."
1.00001E+11,CORDIS US CORP. ,No ,No ,No ,No ,No ,No ,No ,0,0,352,0,0,0,0,0,0,0,Our assumptions document is on file if requested
1.00001E+11,MedAlliance LLC ,No ,No ,No ,No ,No ,No ,No ,0,0,0,0,0,0,0,0,0,0,Our assumptions document is on file if requested
1.00001E+11,M.A. Med Alliance S.A. ,No ,No ,No ,No ,No ,No ,No ,0,0,0,0,0,0,0,0,0,0,Our assumptions document is on file if requested
1.00001E+11,Veryan Medical Incorporated ,No ,No ,No ,No ,No ,No ,No ,0,0,85,0,0,0,0,0,0,0,Our assumptions document is on file if requested.
1E+11,Canon Medical Systems Corporation ,No ,No ,No ,No ,No ,No ,No ,0,4,0,0,0,0,0,0,0,0,Paid in Japanese Yen (JPY) are converted to US DOllars (USD) at the rate of 145 JPY/USD
1.00001E+11,"Paragonix Technologies, Inc. ",No ,No ,No ,No ,No ,No ,No ,0,5,13,0,0,0,0,0,0,0,"Paragonix-Technologies, Inc. has made every effort and performed our due diligence to verify all information submitted to CMS is accurate, complete, and correct to the best of our knowledge. In addition, per guidance from the CMS Medical Device and Medical Supply Name and Primary Device Identifier Dataset Instructions, the ""Primary Device Identifier"" field was left blank as all Paragonix related devices do not appear in the Medical Device and Medical Supply Name and Primary Device Identifier Dataset. Due to the nature of Paragonix Technologies business Human Organ Surgical Recovery services, the associated transfers of value are classified as consulting fees due to the available CMS expense type options and in absence of a more specific expense categorization."
1E+11,"Medtronic, Inc. ",No ,No ,No ,No ,No ,No ,No ,0,3411,69390,260,0,0,0,0,0,0,"Please note, for calendar-year 2021 and forward, due to a business restructure, payments and transfers of value previously reported under the following Open Payments entities will be incorporated within the Medtronic, Inc. (100000000106) reporting entity:- Covidien LP (100000000083)- Medtronic MiniMed, Inc. (100000010391)- Medtronic USA, Inc. (100000010383)- Medtronic Vascular, Inc. (100000010384)Medtronic will now report all payments and transfers of value under one entity, Medtronic, Inc. (100000000106)Please contact Patrick Bodine, Sr. Compliance Program Manager, @ 763-505-3148 or patrick.bodine@medtronic.com with any questions."
1.00001E+11,"Polarean, Inc. ",No ,No ,No ,No ,No ,No ,No ,0,0,0,0,0,0,0,0,0,0,"Polarean Inc. (Polarean) has made every effort and performed the necessary due diligence to verify all information submitted to CMS is accurate, complete, and correct to the best of our knowledge. Per the Open Payments guidelines as it pertains to an entity's 180 grace period following its first product becoming ""covered"", Polarean's 2023 reports consist of data with transaction dates of June 21, 2023 - December 31, 2023."
1.00001E+11,"Delphinus Medical Technologies, Inc. ",No ,No ,No ,No ,No ,No ,No ,0,0,0,3,0,0,0,0,0,0,Practitioners that had multiple similar expenses on differing dates were aggregated and reported as of the first date of that type of expense being incurred (in accordance with reporting guidance).
1.00001E+11,RedHill Biopharma Inc. ,No ,No ,No ,No ,No ,No ,Yes ,0,75,2249,0,0,0,0,3,61.53,2,"RedHill Biopharma Inc.8041 Arco Corporate Dr., Suite 200Raleigh, NC  27617Assumptions Document for Open Payments Program Year 2023 Data________________________________________1. Data subset for former RedHill employee Brooke Reaves:Upon resignation, this employee failed to provide the sign in sheets for several meals on her final expense report and discarded the documentation instead of returning it to RedHill as requested.  It is possible that there were HCPs that we are unable to report.  Those meals were dated 03/01/2023 - 03/31/2023.  2.  Data subset for RedHill employee Mario Arena:Due to a system issue, there was a meal provided on 11/03/2023 and 11/17/2023 that were unable to be reported.  3.  Additional records: RedHill Biopharma Inc has made every attempt to report the following 2023 transfers of value, but the following records would not load to Open Payments after numerous attempts.  Therefore RedHill Biopharma is including them as part of our assumption statement in compliance with CMS Open Payments reporting regulations:Rebecca Izrailova PA, NPI# 1114679024, 363A00000X, SLN-NY-28212, Food and Beverage9/10/2023, $20.39, Product Talicia 57841-1150-212/4/2023, $22.35, Product Talicia 57841-1150-2Natalia Martin DO, NPI# 1487273512, 207R00000X, SLN FL-OS20134, Food and beverage12/07/2023, $18.79, Product Talicia 57841-1150-2"
1E+11,"Silk Road Medical, Inc. ",No ,No ,No ,No ,Yes ,Yes ,No ,0,0,2211,0,0,0,0,409,39012.34,169,Removed due to error E-414 E-415AARATHI MINISANDRAM 1932736378 119.82ABRAHAM COOPER 1407548852 18.54ALA'A ALDEEN ALKHATIB 1982336376 47.61ALI HAKIMI 1104529825 177.17 140.58ALLISON BLUMENFELD 1306465026 138.56 15.43ALYSSA KESSEL 1306426226 138.56ANDREW SHEVITZ 1487231049 177.17 140.57ARMELLE DERISO 1710566906 156.72BENJAMIN FORD 1063049583 142.86BLAKE GUDMUNDSON MURPHY 1366021891 142.86BRITTANY AICHER 1730574120 180.51 20.45 196.35CARLIN LEE 1487281374 30.35COLBY CAYTON 1902556954 119.82CONNOR HOGAN 1578140513 27.08DANIELA MEDINA 1700529534 59.13DAVID EBERTZ 1497215818 17.5 17.5 319.2DOMINIC FACCIPONTE 1225788300 171.06DONNA BAHROLOOMI 1043715378 151.77ELLIOTT ORLOFF 1831773910 39.64EMELYN MAGTANONG 1013584424 169.01EMILY UNRUE 1215630900 58.09GAUTAM YADLA 1295396539 152.38GERRY VICTOR 1538745070 59.12 31.38HATAKA MINAMI 1629711155 42.15HENRY TOWERY 1760178214 147.03 147.05 105.13 141.47HOLLY TOY 1144961764 28.9IAN COOK ARMSTRONG 1053949842 42.15 134.75JACK DOENGES 1790305605 25.9JACOB HARRISON 1790476091 18.54JACOB SIFERS 1316688575 28.91JESSICA LANDAU 1275282949 16.08JOHN TAAFFE 1487237350 140.47JOSEPH ANTONIOS 1447815980 226.91 210.6 559.8 54.44 218.73 102.91JOSHUA GEIGER 1003492968 142.85KAPLAND OWENS 1356978027 18.87KELSI HIRAI 1306379524 14.99KENDRA COLBERT 1639755168 169.83KEVIN LAU 1407531239 96.97LAMA OBEID 1558717041 99.23 76.63 9.5 142.85LOUGHLIN WYLIE 1013477199 722.35 177.17LUKE KEFFER 1003518424 119.82MACKENZIE MADISON 1497329023 171.1MARL JAY R MASCOTE 1073389011 170.76MARYAM BOUMEZRAG 1982164042 30.43MATTHEW ROSSI 1386149458 56.21 156.29MCDANIEL LANG 1366010977 138.56MELISSA DAY 1811457187 226.91 210.6 709.1 167.58 102.91MICHAEL CAREY 1023711454 98.37 140.57MIIMII THAE 1134797905 24.43MUHAMAD HASSAN SHAKIR 1205574068 168.48OZ HAIM 1659082162 135 172.27 219.94 207.05 748.14 170.89PAIGE MOUDY 1538746060 47.62PAUL HADDAD 1376109785 10.61 86 82 16.59 134.75 34.94 150 148.93 114.24 28.55 172.27 127.97 164.67 143.96PETER CARMICHAEL 1740817055 177.18PHILIP SKUMMER 1104386911 63.52 21.13POURIA MOSSAHEBI 1063919900 63.52PRIYA PATEL 1467802959 128.21RACHEL GRINNAN 1215383815 149.27RACHEL OPPENHEIM 1700465713 22.63 140.47RAINNA COELHO 1871121293 27.08RAMSEY ELSAYED 1003553918 131.81REBEKAH BJORKLUND 1225772924 47.61REGINA HUSMAN 1033748330 137.96 19.5 153.28ROBERTO LOANZON 1578182234 149.72ROSE GOODING 1780116087 16.48RYAN BIRD 1043730492 308.03 60.76 160.63 208.52 194.55 27.1 168.2 59.69SARA MYERS 1255918181 40.33SATINDERJIT LOCHAM 1245893387 138.56SEAN FRANCOIS 1073073136 119.83SHELBY BUCKNER 1861142101 27.07SHRISHIV TIMBALIA 1629694575 148.92 114.24 127.97 143.96SUMEDH SHAH 1336776905 33.86TARUNDEEP SINGH 1013571694 16.59 134.75 34.94 114.24 172.28 143.96 138.55TREVOR DOREY 1083233696 54.74 35.38TYLER CARDINAL 1104576156 33.85WILLIAM ZICKLER 1245764042 31.97ZACHARY SANFORD 1952861619 137.95 153.28MARK ZEMELA 1184206633 5.77 5.83 6.32 21.82 24.37 40.96 42.94 48.18 80.8 96.25 129.71 165.53Removed due to error E-619 E-620BENJAMIN LEE 1174229561 25.57CARL PETTY 1366144941 30.9 73 224.27 374.96 275.3 84.09LINDA MARTILLA 1235129578 149.27JARED GOWEN 1023690195 118.13 141.03LAUREN GAMMEL 1033645585 7.6 41.24 44.35BRITTANY Willams 1043808652 98.37LAURA HORNBACK 1053061218 28.91RAJ PATEL 1053061671 56.2STEVEN MENG 1073263521 159.68ERIC GINSBERG 1083108732 12.22 15.3 173.25DAVID PARR 1104402783 151.92ALEJANDRA RODRIGUEZ 1104576875 159.68PRATIK CHOWDHURY 1114554573 19.24ARON LICHT 1114661287 161.12ISAAC LIES 1124719059 146.88 184.01AHMAD ALJAYEH 1154017887 47.61DEREK HOLLAND 1164164778 15.34CHRISTOPHER FARIES 1194455022 27.31 30.2 31.98 34.69 219.36ZACHARY LAWRENCE 1205491628 138.56CAYETANA LAZCANO ETCHEBARNE 1205512761 9NEIL FESTE 1205586153 151.92ADRIAN SANTINI 1215498845 16.88 17.43 18.2 70.63 76.12 81.22 85.31 120.76TIMOTHY BAUMGARTNER 1215628847 47.61KAYLA WILLIAMSON 1215631098 13.18KYLE PROCHNO 1215631296 127.96 143.96 148.92KRISTOPHER JOHNSON 1265994446 138.56MALLIKA GOPAL 1275197469 28.18 31.16KARUNESH POLIREDDY 1275235269 24.16 143.07SEBASTIAN LOPEZ 1285261065 120.77AIDIN BAGHBANIOSKOUEI 1285337121 153.29GIOVANNA MELE 1285383125 308.04MARGARET BUTCHY 1306406939 5.76 135.36ROBERT CRAGON 1306580618 81.22 120.76JHONIEL PEREZ 1336851864 9ALEKSANDR KRICHMAR 1346827318 152.15Elizabeth Moteiro 1356084693 114.38CHRISTINA VEITH 1386271179 17.43 18.19 19.21 28.21 81.22 120.77CHARLES HILLENBRAND 1407210206 63.29BESHER TOLAYMAT 1417512997 5.38 5.77 5.84 6.49 8.93 21.82 24.37 40.96 42.93 48.19 80.8 96.25 122.19CLARK RESTREPO 1427637057 30.44JOLIE MURCKO 1457091191 151.92Adele Heib 1457933251 30.47CHRISTOPHER HATZIS 1457988438 25.66 34.59 219.36STEVEN HERNANDEZ 1487117305 11.41 26.56 140.04 151.93 160.05 164.52KSHITIJ DESAI 1497214530 11.21 22.48 26.38 142.85 198.83BRITTANY FRASER 1538621651 32 102.91 118.13 141.03 167.57 210.6 226.91 966.41AUSTIN PRICE 1538788468 118.13 140.57 141.03ANTONY AZIZ 1548906191 5.38 5.77 5.95 6.31 10.16 21.81 24.38 40.95 42.94 48.19 80.81 96.26 129.72 165.52BRIAN KOPPING 1548956485 151.92DOMINIQUE DOCKERY 1578266821 161.13DEVANSHI PATEL 1619506599 128.99Ashley Hsu 1629770326 146.91HAYDEN CAUDILL 1639814429 28.74 120.77PARANJAY PATEL 1669175584 127.96YOSUKE SAKURAI 1689292872 12.87ALEC SCHUBERT 1689307019 5.76 6.49 10.17 21.82 129.71 165.53Stephanie Brierley 1699353375 16.96HANNAH ODEN-BRUNSON 1699464586 141.48ZOE GUZMAN 1710448188 151.93AAKANKSHA GUPTA 1710507330 5.76 5.83 6.32 7.65 8.93 24.37 40.96 42.94 48.18 80.8 96.25 129.72 135.35NOAH DARGY 1710567748 16.89 18.2 120.76ABIGAIL CLARK 1720607633 5.77 5.96 40.96 42.94 80.81 96.25 122.19 135.35ANGELIS LAU 1720643703 151.92SHARON SHIM 1740999390 11.65 139.35DANIEL KONG 1760069694 8.23 11.6 56.2DYLAN GOEHNER 1790300333 138.56MEIYI SHI 1801356449 26.57 140.04 151.92HAYLIE REED 1801392212 118.14 16.33 23.23JOSEPH SLAUGHTER 1811526908 16.33 23.23 20.35Kate Kim 1811691413 23.23 20.35 18.19SACHIN JAIN 1821550427 20.35 18.19 20.36Elizabeth Williams 1821792508 18.19 20.36JOHN LEE 1831756808 34.68 34.68 35.34KELSEY BERGER 1871056945 34.68 35.34ABDUL KHAN 1871080325 148.92 118.13 8.23NIKITA SINGH 1871234914 118.13 8.23 11.6MABEL CHAN 1891226924 8.23 11.6 20.75 56.21Darryn Vasquez 1891499919 47.62 15.34 28.91MICHAEL STOLTZ 1902428311 15.34 28.91 27.08BRIANA ISHMAEL 1912647298 28.91 27.08 308.04KAYLA NGUYEN 1912649567 27.08 308.04 47.62EMMA MOREL 1922684976 308.04 47.62 5.77COLE JOUBERT 1922799873 47.62 5.77 5.83PATRICK CONROY 1932802857 5.77 5.83 6.49 8.76 8.93 21.82 129.72 165.52NICHOLAS GILBERT 1942707096 77.34 112.48BIANCA FISCHER 1942887153 151.92 34.94 13.18EVAN RIGGS 1942902119 34.94 13.18 17.8CARRISA SCHWARTZ 1972253375 13.18 17.8 23.24JOSHUA HARRIS 1982164372 17.8 23.24 29.52 34.58 54.44 102.91 210.6 218.72 219.36 226.91 634.81SYED ZAMIN 1992324743 143.7 33.71 79.73JOSEPH ANTONIOS 1447815980 33.71 79.73SARIT SANDOWSKI 1861847493 1200 100.81JOSHUA HARRIS 1982164372 100.81
1E+11,Sandoz Inc. ,No ,No ,No ,No ,No ,Yes ,Yes ,0,0,1689,0,0,0,0,0,0,0,"Sandoz Inc. has made every effort and performed our due diligence to verify all information submitted to CMS is accurate, complete, and correct to the best of our knowledge. In the instances where the covered recipient failed the CMS matching/validation process the records were deleted to proceed with the submission."
1.00001E+11,"SCYNEXIS, Inc. ",No ,No ,No ,No ,No ,No ,No ,0,0,0,0,0,0,0,0,0,0,Scynexis does not have any general payments to report for 2023
1E+11,Novastep Inc. ,No ,No ,No ,No ,No ,No ,No ,0,0,2,0,0,0,0,0,0,0,"See attestation under MedShape, a NovaStep sister entity"
1.00001E+11,"Seres Therapeutics, Inc. ",No ,No ,No ,No ,No ,No ,No ,0,62,0,0,0,0,0,0,0,0,"Seres Therapeutics Inc has made every effort and performed the necessary due diligence to verify all information submitted to CMS is accurate, complete and correct to the best of our knowledge. Per the Open Payments guidelines as it pertains to an entity 180 grace period following its first product becoming covered, Seres 2023 reports consist of data with transaction dates of October 23rd 2023 through December 31st 2023."
1E+11,Skeletal Dynamics Inc ,No ,No ,Yes ,No ,Yes ,No ,Yes ,0,0,21,2,0,0,0,5,1617.8,0,"Skeletal Dynamics: Open Payments Assumptions (March 2023)1. Skeletal Dynamics, Inc. (Skeletal Dynamics) uses its best knowledge of providers and the credentials under which they practice to determine which providers are reportable as covered recipients as defined under 42 C.F.R. & 403.902.2. Once a covered recipient is identified, Skeletal Dynamics will report the associated transfers of value (TOV) for the entire year for that covered recipient.  If an individual becomes a covered recipient during the reportable year, any TOV for the entire year available to and accessible by Skeletal Dynamics at the time of reporting will be reported.  3. Dates for cash TOVs to covered recipients will be reported as the date the payment was made.  Dates for payments made with corporate American Express credit cards will be reported as the dates the charges were incurred.  Dates for meals and refreshments will be reported as the dates the associated events took place.4. The reporting template allows for listing of up to 5 products per payment.  Beginning in 2021, when more than 5 products are associated with a payment, Skeletal Dynamics will provide the first 5 products in alphabetical order.  Prior to 2021, Skeletal Dynamics listed products based on an assessment of which were most relevant to the covered recipient's activity, with the most relevant products being listed first.5. Skeletal Dynamics reports all devices by the product marketed or brand name.6. Payments to a teaching hospital and payments that benefit a teaching hospital will be reported when the recipient party tax ID number and/or the recipient teaching hospital name and address match a covered recipient on the CMS teaching hospital list for that reportable year.7. Valuations for educational reprints are based on the cost to Skeletal Dynamics to obtain the reprints.8. Prior to 2020, Skeletal Dynamics had concluded that interest payments made to covered recipients for loans unsecured and subordinated to Skeletal Dynamics's operating line of credit were not required to be reported through Open Payments since the regulations exclude from the definition of ownership or investment interests unsecured loans subordinated to a credit facility and because there is no reporting category for interest on a loan.  42 CFR && 403.902, 403.904.  Skeletal Dynamics considered interest on the loan to be a return to the covered recipient lender of the covered recipient's unreportable investment interest.  In connection with its 2020 filing, Skeletal Dynamics has reconsidered this conclusion and going forward will be reporting such interest payments as TOVs.  Skeletal Dynamics will also be revising its disclosures from prior years to account for this change in methodology. 9. Skeletal Dynamics seeks information quarterly from its US distributors regarding TOVs made by the distributors to covered recipients. Prior to 2020, Skeletal Dynamics reported the TOVS disclosed to it by its US distributors through Open Payments, and some TOVs so-reported may not have had any Skeletal Dynamics involvement.  In connection with its 2020 filing, Skeletal Dynamics has reconsidered this conclusion and going forward will be reporting TOVs to covered recipients made by its US distributors only when Skeletal Dynamics requires, instructs, directs, or otherwise causes the distributor to provide the TOV, in whole or in part, to the covered recipient, consistent with 42 CFR & 403.904(a).10. Supplies and materials that are considered to be of de minimis value are not tracked by Skeletal Dynamics's vendors and will not be included in the report.11. Where a physician NPI and/or license number cannot be found using NPPES or a state licensure database, Skeletal Dynamics will contact the person to whom the payment was made as well as his or her office.  In the event that Skeletal Dynamics is not able to obtain the information through these means and thus cannot fill in the NPI and/or licensure fields in the report, Open Payments does not allow the reporting of a TOV; accordingly, Skeletal Dynamics will not report the associated TOV but will maintain an internal record of the TOV and the efforts made to obtain the NPI and/or license number information.12. Skeletal Dynamics's general payments and research report includes all information required to be reported pursuant to the Sunshine Act, which is available to and accessible by Skeletal Dynamics at the time of reporting.  It is possible that certain errors and omissions may exist in the reported information due to circumstances beyond Skeletal Dynamics's direct control.  These circumstances may include, but are not limited to, delays in receipt of the reportable data, missing or irretrievable data, and/or data omitted from information that is provided by vendors or other necessary sources of information."
1E+11,Novo Nordisk Inc ,No ,Yes ,No ,Yes ,No ,Yes ,Yes ,0,2987,202358,0,12,0,0,1,403.9,0,"SPEND NOT ASSOCIATED WITH COVERED PRODUCTS As a general matter, the company believes that the following types of expenses are not related to covered products and, therefore, are not reported if incurred by the company's applicable manufacturers that have limited reporting obligations per 42 CFR 403.904b corporate giving, Independent Medical Education, employment recruiting costs, payments for services associated with non-marketed products. Novo Nordisk A/S, Novo Nordisk Healthcare AG, and Novo Nordisk Inc., are Paragraph 1 manufacturers, and Novo Nordisk Research Center Seattle, Inc. is a Paragraph 2 manufacturer. INDIRECT PAYMENTS As a general matter, except as otherwise required under the special rules for reporting research payments, contracts with institutions for the services of named physicians were reported in the names of the physicians and or the relevant teaching hospitals, where applicable, unless the contracted institution confirmed no pass-through payment to the physician or teaching hospital.PAYMENT DATE Payments and transfers of value related to consulting, advisory boards, and speaker programs were reported using the meeting date as the date of payment. Payments related to in office meals were reported using the transaction date. Transfers of value related to clinical trials, e.g., supplies and equipment, were generally reported based on date of shipment. MEALS Multiple meals provided during the course of an activity, particularly multi-day events, may be reported as a single transfer of value. RESEARCH As a general matter, the report includes investigator fees, site specific expenses, fees, payments or transfers of value via CROs, equipment, ancillary supplies, local IRB fees, and commercially available drug provided for investigator sponsored studies. The report includes the name of the contractual entity as the entity receiving the transfer of value.MATCHING VALIDATION To help ensure covered recipient identity matching, where possible, the physician and non-physician identifiers reported, including state license, number, name, etc. match those as listed in the CMS VPL and the NPPL. There are cases where the identifiers included in the VPL for physicians and NPPL for non-physicians are inconsistent with information the company maintains for the individuals. To help ensure that the records the company submits are accepted by the Open Payments system, the company has reported physician identifiers listed in the VPL and non-physician identifiers as listed in the NPPL, even in cases where the company's data is inconsistent with the information in the VPL and NPPL.  In addition, there is a small number of covered recipients to whom we provided reportable payments and transfers of value and for whom the Open Payments system was unable to match their identities. The Open Payments system does not permit submission of those records that cannot pass matching validation. We have deleted those records from our submission and documented the matching attempts in our records. DATA LIMITATIONS This submission includes data maintained in the company's systems as of March 15, 2024, that has been processed in accordance with applicable policies and procedures, and that has been validated as representing reportable payments or transfers of value provided to covered recipients during the period January 1 to December 31, 2023.  The March 15, 2024, data cutoff date is necessary to provide sufficient time to complete the company's process for verifying the accuracy and completeness of the submission.  Any data that may enter the company's systems after March 15, 2024, that reflects interactions during the reporting period, will be separately analyzed and validated to assess whether it impacts this submission.ADDITONAL ATTESTATION PRIOR TO MARCH 31 DEADLINE: Some additional PY 2023 data was received after the company's data cutoff date of March 15, 2024, however, the company has been able to process it and prepare it for timely submission and attestation prior to the March 31st deadline."
