1E+11,"Johnson & Johnson Surgical Vision, Inc. ",No ,Yes ,Yes ,Yes ,No ,No ,Yes ,0,0,92,0,0,0,0,0,0,0,"The information reported in this submission reflects the Company's good faith and best efforts to comply with the requirements of 42 CFR section 403.900-914.  The Company relies on a combination of automated systems, standardized processes, and manual data entry to record relevant data and complete the submission.  In some cases, the Company must rely on information it receives from independent third parties, e.g., grant recipients, regarding payments or other transfers of value they provide to Covered Recipients that represent indirect payments from the Company to Covered Recipients.  As is the case with any complex environment that involves large amounts of data and relies on human involvement, there are inherent limitations, and the information submitted is necessarily limited to data within the Company's systems and underlying processes that reflects interactions with Covered Recipients at a particular point in time.  We constantly evaluate our systems and processes to ensure the data we report is as complete, accurate and timely as possible. In certain situations, we discover reportable data after the relevant reporting deadline.  In light of our commitment to transparency, which we share with the Agency, we include that data in subsequent updates.In addition, in accordance with CMS instructions, the covered recipient identifiers reported, including state license number, name, etc., match those as listed in the CMS Validated Physician List & Non-Physician Lists, where possible.  There are cases where the identifiers included in the Validated Lists for particular covered recipients are inconsistent with information the Company maintains for the individuals.  To help ensure that the records the Company submitted would be accepted by the Open Payments system, the Company reported covered recipient identifiers listed in the Validated List as CMS has instructed, as a general matter, even in cases where the Company's data suggests information in the Validated Lists  are not accurate or up to date.  Additionally, CMS has acknowledged that the Validated Lists are not an exhaustive listing of U.S. covered recipients, and the Validated Lists in fact do not include all covered recipients to whom the Company furnished reportable payments or other transfers of value during the reporting period.  The Company has made good faith efforts to timely submit records via the Open Payments system that are associated with covered recipients who are not on the Validated Lists, and which CMS has been otherwise unable to match, but the system may not be able to accept them because of the inability to match the records.  The Company is committed to working with CMS to help resolve the matching issues so that those records can be officially accepted by the Open Payments system and published."
1E+11,"Janssen Research & Development, LLC ",No ,Yes ,Yes ,Yes ,No ,No ,Yes ,0,0,128,0,0,0,0,0,0,0,"The information reported in this submission reflects the Company's good faith and best efforts to comply with the requirements of 42 CFR section 403.900-914. The Company relies on a combination of automated systems, standardized processes, and manual data entry to record relevant data and complete the submission. In some cases, the Company must rely on information it receives from independent third parties, e.g., grant recipients, regarding payments or other transfers of value they provide to Covered Recipients that represent indirect payments from the Company to Covered Recipients. As is the case with any complex environment that involves large amounts of data and relies on human involvement, there are inherent limitations, and the information submitted is necessarily limited to data within the Company's systems and underlying processes that reflects interactions with Covered Recipients at a particular point in time. We constantly evaluate our systems and processes to ensure the data we report is as complete, accurate and timely as possible. In certain situations, we discover reportable data after the relevant reporting deadline. In light of our commitment to transparency, which we share with the Agency, we include that data in subsequent updates.In addition, in accordance with CMS instructions, the covered recipient identifiers reported, including state license number, name, etc., match those as listed in the CMS Validated Physician List & Non-Physician Lists, where possible. There are cases where the identifiers included in the Validated Lists for particular covered recipients are inconsistent with information the Company maintains for the individuals. To help ensure that the records the Company submitted would be accepted by the Open Payments system, the Company reported covered recipient identifiers listed in the Validated List as CMS has instructed, as a general matter, even in cases where the Company's data suggests information in the Validated Lists are not accurate or up to date. Additionally, CMS has acknowledged that the Validated Lists are not an exhaustive listing of U.S. covered recipients, and the Validated Lists in fact do not include all covered recipients to whom the Company furnished reportable payments or other transfers of value during the reporting period. The Company has made good faith efforts to timely submit records via the Open Payments system that are associated with covered recipients who are not on the Validated Lists, and which CMS has been otherwise unable to match, but the system may not be able to accept them because of the inability to match the records. The Company is committed to working with CMS to help resolve the matching issues so that those records can be officially accepted by the Open Payments system and published."
1E+11,"Janssen Global Services, LLC ",No ,Yes ,Yes ,Yes ,No ,No ,Yes ,0,0,4,0,0,0,0,1,403.9,0,"The information reported in this submission reflects the Company's good faith and best efforts to comply with the requirements of 42 CFR section 403.900-914. The Company relies on a combination of automated systems, standardized processes, and manual data entry to record relevant data and complete the submission. In some cases, the Company must rely on information it receives from independent third parties, e.g., grant recipients, regarding payments or other transfers of value they provide to Covered Recipients that represent indirect payments from the Company to Covered Recipients. As is the case with any complex environment that involves large amounts of data and relies on human involvement, there are inherent limitations, and the information submitted is necessarily limited to data within the Company's systems and underlying processes that reflects interactions with Covered Recipients at a particular point in time. We constantly evaluate our systems and processes to ensure the data we report is as complete, accurate and timely as possible. In certain situations, we discover reportable data after the relevant reporting deadline. In light of our commitment to transparency, which we share with the Agency, we include that data in subsequent updates.In addition, in accordance with CMS instructions, the covered recipient identifiers reported, including state license number, name, etc., match those as listed in the CMS Validated Physician List & Non-Physician Lists, where possible. There are cases where the identifiers included in the Validated Lists for particular covered recipients are inconsistent with information the Company maintains for the individuals. To help ensure that the records the Company submitted would be accepted by the Open Payments system, the Company reported covered recipient identifiers listed in the Validated List as CMS has instructed, as a general matter, even in cases where the Company's data suggests information in the Validated Lists are not accurate or up to date. Additionally, CMS has acknowledged that the Validated Lists are not an exhaustive listing of U.S. covered recipients, and the Validated Lists in fact do not include all covered recipients to whom the Company furnished reportable payments or other transfers of value during the reporting period. The Company has made good faith efforts to timely submit records via the Open Payments system that are associated with covered recipients who are not on the Validated Lists, and which CMS has been otherwise unable to match, but the system may not be able to accept them because of the inability to match the records. The Company is committed to working with CMS to help resolve the matching issues so that those records can be officially accepted by the Open Payments system and published."
1E+11,"Actelion Pharmaceuticals, Ltd ",No ,Yes ,Yes ,Yes ,No ,No ,Yes ,0,0,2,0,0,0,0,0,0,0,"The information reported in this submission reflects the Company's good faith and best efforts to comply with the requirements of 42 CFR section 403.900-914. The Company relies on a combination of automated systems, standardized processes, and manual data entry to record relevant data and complete the submission. In some cases, the Company must rely on information it receives from independent third parties, e.g., grant recipients, regarding payments or other transfers of value they provide to Covered Recipients that represent indirect payments from the Company to Covered Recipients. As is the case with any complex environment that involves large amounts of data and relies on human involvement, there are inherent limitations, and the information submitted is necessarily limited to data within the Company's systems and underlying processes that reflects interactions with Covered Recipients at a particular point in time. We constantly evaluate our systems and processes to ensure the data we report is as complete, accurate and timely as possible. In certain situations, we discover reportable data after the relevant reporting deadline. In light of our commitment to transparency, which we share with the Agency, we include that data in subsequent updates.In addition, in accordance with CMS instructions, the covered recipient identifiers reported, including state license number, name, etc., match those as listed in the CMS Validated Physician List & Non-Physician Lists, where possible. There are cases where the identifiers included in the Validated Lists for particular covered recipients are inconsistent with information the Company maintains for the individuals. To help ensure that the records the Company submitted would be accepted by the Open Payments system, the Company reported covered recipient identifiers listed in the Validated List as CMS has instructed, as a general matter, even in cases where the Company's data suggests information in the Validated Lists are not accurate or up to date. Additionally, CMS has acknowledged that the Validated Lists are not an exhaustive listing of U.S. covered recipients, and the Validated Lists in fact do not include all covered recipients to whom the Company furnished reportable payments or other transfers of value during the reporting period. The Company has made good faith efforts to timely submit records via the Open Payments system that are associated with covered recipients who are not on the Validated Lists, and which CMS has been otherwise unable to match, but the system may not be able to accept them because of the inability to match the records. The Company is committed to working with CMS to help resolve the matching issues so that those records can be officially accepted by the Open Payments system and published."
1E+11,ResMed Corp ,No ,No ,No ,No ,No ,No ,No ,0,0,365,0,0,0,0,0,0,0,The value of devices or equipment provided for Research studies or clinical trials was calculated by the product of the Fair market value of the device and the units of the devices provided. For studies spanning multiple years the Amount was divided by the total duration of study and the result was multiplied by the duration of the current year to compute the TOV attributed to the current year.
1.00001E+11,Shield Therapeutics Inc ,No ,No ,No ,No ,No ,Yes ,Yes ,0,120,6200,0,0,0,0,3,64.89,2,There were records we were unable to validate through the Federal System even though our sources are indicating reportable spend. We reached out the Open Payments helpdesk and have been instructed to delete the records from the file and include them as assumptions. The records in question are the following:Category Date Amount        HCP Name                          NPI                 State LicenseMeal 20231212 $22.92  FARNAAZ KIA                         1730674466 CA: A 165884Meal 20230815 $22.78  YARRELL AFI AMETEWEE 1568116028 NY: 027523Meal 20230406 $19.19  YARRELL AFI AMETEWEE 1568116028 NY: 027523
1E+11,"Biocodex, Inc. ",No ,No ,No ,No ,No ,No ,No ,0,0,121,0,0,0,0,0,0,0,These payments are all payments for 2023
1.00001E+11,"Masters Drug Company, Inc. ",No ,No ,No ,No ,No ,No ,No ,0,0,0,0,0,0,0,0,0,0,"This attestation is based on reasonable due diligence and good-faith efforts to comply with the Sunshine Act.  Masters Drug Company reporting and attestation should not be deemed a concession with respect to any legal, regulatory, or other requirement or issue that may apply to a particular reported payment or other transfer of value.  In addition, Masters Drug Company expressly reserves all rights to interpret and apply the Sunshine Act, including but not limited to, its rights to make good-faith determinations as to whether and how the Sunshine Act applies to its activities and operations.    Furthermore, Masters Drug Company has used good-faith efforts to accommodate technical and other challenges related to the Centers for Medicare & Medicaid Services (CMS) portal."
1.00001E+11,McKesson Drug Company LLC ,No ,No ,No ,No ,No ,No ,No ,0,0,0,0,0,0,0,0,0,0,"This attestation is based on reasonable due diligence and good-faith efforts to comply with the Sunshine Act.  McKesson Drug Company LLC reporting and attestation should not be deemed a concession with respect to any legal, regulatory, or other requirement or issue that may apply to a particular reported payment or other transfer of value. In addition, McKesson Drug Company LLC expressly reserves all rights to interpret and apply the Sunshine Act, including but not limited to, its rights to make good-faith determinations as to whether and how the Sunshine Act applies to its activities and operations.Furthermore, McKesson Drug Company LLC has used good-faith efforts to accommodate technical and other challenges related to the Centers for Medicare & Medicaid Services (CMS) portal."
1E+11,"McKesson Medical-Surgical Minnesota Supply, Inc ",No ,No ,No ,No ,No ,No ,No ,0,0,12,0,0,0,0,0,0,0,"This attestation is based on reasonable due diligence and good-faith efforts to comply with the Sunshine Act.  McKesson Medical-Surgical Minnesota Supply, Inc reporting and attestation should not be deemed a concession with respect to any legal, regulatory, or other requirement or issue that may apply to a particular reported payment or other transfer of value.  In addition, McKesson Medical-Surgical Minnesota Supply, Inc expressly reserves all rights to interpret and apply the Sunshine Act, including but not limited to, its rights to make good-faith determinations as to whether and how the Sunshine Act applies to its activities and operations. Furthermore, McKesson Medical-Surgical Minnesota Supply, Inc has used good-faith efforts to accommodate technical and other challenges related to the Centers for Medicare & Medicaid Services (CMS) portal."
1E+11,"McKesson Medical-Surgical, Inc. ",No ,No ,No ,No ,No ,No ,No ,0,0,39,1,0,0,0,0,0,0,"This attestation is based on reasonable due diligence and good-faith efforts to comply with the Sunshine Act.  McKesson Medical-Surgical, Inc. reporting and attestation should not be deemed a concession with respect to any legal, regulatory, or other requirement or issue that may apply to a particular reported payment or other transfer of value.  In addition, McKesson Medical-Surgical, Inc. expressly reserves all rights to interpret and apply the Sunshine Act, including but not limited to, its rights to make good-faith determinations as to whether and how the Sunshine Act applies to its activities and operations.  Furthermore, McKesson Medical-Surgical, Inc. has used good-faith efforts to accommodate technical and other challenges related to the Centers for Medicare & Medicaid Services (CMS) portal."
1.00001E+11,McKesson Plasma and Biologics LLC ,No ,No ,No ,No ,No ,No ,No ,0,0,0,0,0,0,0,0,0,0,"This attestation is based on reasonable due diligence and good-faith efforts to comply with the Sunshine Act.  McKesson Plasma and Biologics LLC reporting and attestation should not be deemed a concession with respect to any legal, regulatory, or other requirement or issue that may apply to a particular reported payment or other transfer of value. In addition, McKesson Plasma and Biologics LLC expressly reserves all rights to interpret and apply the Sunshine Act, including but not limited to, its rights to make good-faith determinations as to whether and how the Sunshine Act applies to its activities and operations.Furthermore, McKesson Plasma and Biologics LLC has used good-faith efforts to accommodate technical and other challenges related to the Centers for Medicare & Medicaid Services (CMS) portal."
1.00001E+11,"McKesson Sourcing Services, Inc. ",No ,No ,No ,No ,No ,No ,No ,0,0,0,0,0,0,0,0,0,0,"This attestation is based on reasonable due diligence and good-faith efforts to comply with the Sunshine Act.  McKesson Sourcing Services, Inc. reporting and attestation should not be deemed a concession with respect to any legal, regulatory, or other requirement or issue that may apply to a particular reported payment or other transfer of value.  In addition, McKesson Sourcing Services, Inc. expressly reserves all rights to interpret and apply the Sunshine Act, including but not limited to, its rights to make good-faith determinations as to whether and how the Sunshine Act applies to its activities and operations.    Furthermore, McKesson Sourcing Services, Inc. has used good-faith efforts to accommodate technical and other challenges related to the Centers for Medicare & Medicaid Services (CMS) portal."
1E+11,"McKesson Specialty Care Distribution, LLC ",No ,No ,No ,No ,No ,No ,No ,0,0,0,0,0,0,0,0,0,0,"This attestation is based on reasonable due diligence and good-faith efforts to comply with the Sunshine Act.  McKesson Specialty Care Distribution, LLC reporting and attestation should not be deemed a concession with respect to any legal, regulatory, or other requirement or issue that may apply to a particular reported payment or other transfer of value. In addition, McKesson Specialty Care Distribution, LLC expressly reserves all rights to interpret and apply the Sunshine Act, including but not limited to, its rights to make good-faith determinations as to whether and how the Sunshine Act applies to its activities and operations. Furthermore, McKesson Specialty Care Distribution, LLC has used good-faith efforts to accommodate technical and other challenges related to the Centers for Medicare & Medicaid Services (CMS) portal."
1.00001E+11,"OnMark, Inc. ",No ,No ,No ,No ,No ,No ,No ,0,0,1,0,0,0,0,0,0,0,"This attestation is based on reasonable due diligence and good-faith efforts to comply with the Sunshine Act.  OnMark, Inc. reporting and attestation should not be deemed a concession with respect to any legal, regulatory, or other requirement or issue that may apply to a particular reported payment or other transfer of value.  In addition, OnMark, Inc. expressly reserves all rights to interpret and apply the Sunshine Act, including but not limited to, its rights to make good-faith determinations as to whether and how the Sunshine Act applies to its activities and operations. Furthermore, OnMark, Inc. has used good-faith efforts to accommodate technical and other challenges related to the Centers for Medicare & Medicaid Services (CMS) portal."
1.00001E+11,RxCrossroads 3PL LLC ,No ,No ,No ,No ,No ,No ,No ,0,0,1,0,0,0,0,0,0,0,"This attestation is based on reasonable due diligence and good-faith efforts to comply with the Sunshine Act.  RxCrossroads 3PL LLC reporting and attestation should not be deemed a concession with respect to any legal, regulatory, or other requirement or issue that may apply to a particular reported payment or other transfer of value.  In addition, RxCrossroads 3PL LLC expressly reserves all rights to interpret and apply the Sunshine Act, including but not limited to, its rights to make good-faith determinations as to whether and how the Sunshine Act applies to its activities and operations.    Furthermore, RxCrossroads 3PL LLC has used good-faith efforts to accommodate technical and other challenges related to the Centers for Medicare & Medicaid Services (CMS) portal."
1.00001E+11,"US Oncology Corporate, Inc. ",No ,No ,No ,No ,No ,No ,No ,0,0,11,0,0,0,0,0,0,0,"This attestation is based on reasonable due diligence and good-faith efforts to comply with the Sunshine Act.  US Oncology Corporate, Inc. reporting and attestation should not be deemed a concession with respect to any legal, regulatory, or other requirement or issue that may apply to a particular reported payment or other transfer of value.  In addition, US Oncology Corporate, Inc. expressly reserves all rights to interpret and apply the Sunshine Act, including but not limited to, its rights to make good-faith determinations as to whether and how the Sunshine Act applies to its activities and operations. Furthermore, US Oncology Corporate, Inc. has used good-faith efforts to accommodate technical and other challenges related to the Centers for Medicare & Medicaid Services (CMS) portal."
1E+11,McKesson Corporation ,No ,No ,No ,No ,No ,No ,No ,0,0,0,0,0,0,0,0,0,0,"This attestation is based on reasonable due diligence and good-faith efforts to comply with the Sunshine Act. McKesson Corporation reporting and attestation should not be deemed a concession with respect to any legal, regulatory, or other requirement or issue that may apply to a particular reported payment or other transfer of value. In addition, McKesson Corporation expressly reserves all rights to interpret and apply the Sunshine Act, including but not limited to, its rights to make good-faith determinations as to whether and how the Sunshine Act applies to its activities and operations.   Furthermore, McKesson Corporation has used good-faith efforts to accommodate technical and other challenges related to the Centers for Medicare & Medicaid Services (CMS) portal."
1E+11,Sanofi US Services Inc. ,No ,No ,No ,No ,No ,Yes ,Yes ,0,0,123,0,0,0,0,0,0,0,"This certification is executed in reliance upon reasonable assumptions and decisions made regarding methodology and other aspects of determinations of value, reporting dates, the payment type and nature, limitations of available data, and ongoing review and validation of reported data. Sanofi is committed to reporting information that is timely, accurate and complete to the best of its knowledge and belief. Sanofi may receive or discover information that was not included in an applicable annual report. In accordance with 42 CFR 403.908(h), Sanofi endeavors to submit corrected information in a timely manner upon confirmation. Sanofi has registered entities that meet the definition of Applicable Manufacturer, however due to system limitations certain entity payments are not provided under the individual Applicable Manufacturer, but rather as part of the data provided by one of the other Sanofi entities. In accordance with CMS instructions for Unique Recipient Records, March 20, 2015, after due diligence, all records with a status of Failed Matching Validation have been deleted from the submission."
1E+11,sanofi-aventis U.S. LLC ,No ,No ,No ,No ,No ,Yes ,Yes ,0,0,17312,1,0,0,0,0,0,0,"This certification is executed in reliance upon reasonable assumptions and decisions made regarding methodology and other aspects of determinations of value, reporting dates, the payment type and nature, limitations of available data, and ongoing review and validation of reported data. Sanofi is committed to reporting information that is timely, accurate and complete to the best of its knowledge and belief. Sanofi may receive or discover information that was not included in an applicable annual report. In accordance with 42 CFR 403.908(h), Sanofi endeavors to submit corrected information in a timely manner upon confirmation. Sanofi has registered entities that meet the definition of Applicable Manufacturer, however due to system limitations certain entity payments are not provided under the individual Applicable Manufacturer, but rather as part of the data provided by one of the other Sanofi entities. In accordance with CMS instructions for Unique Recipient Records, March 20, 2015, after due diligence, all records with a status of Failed Matching Validation have been deleted from the submission."
